text,score,url,date,location
Hi. I've been a customer of T-Mobile for 20 yrs now and I have to say Noah at the Washington T-Mobile store has to be the most helpful and nicest representative that I've had the pleasure of dealing with.,24,,"Oct. 24, 2025 Hi. I","Hackettstown, NJ"
"This is the most upset I’ve been with T-Mobile since I was a kid. They’ve been charging me for international calling since 2022, even though I canceled it a few months after getting WhatsApp. Somehow, they have no record of my cancellation and have been adding an extra $15 to my bill every month for three years. When I called today, I was told it won’t be fixed until November 8 — the exact same line I was given three years ago. The only “resolution” offered was two months of credit and $10 off per month, after already taking more than $500 from me. The craziest part? The issue still isn’t fixed, and T-Mobile can clearly see that my international calling usage has been zero for the past 90 days. T-Mobile, please make this right.",24,,"Oct. 24, 2025 This is the most upset I","Newnan, GA"
"The absolute worst in the business. They make promises and then pull the rug out and don't care one bit about you as a customer. Read every letter of every piece of paper you agree to with them. Their representatives will tell you one thing and in the fine print it says something else. Who is to blame? ""YOU.""",24,,"Oct. 24, 2025 The absolute worst in the business. They make promises and then pull the rug out and don","Chicago, IL"
"She always manages to catch the phone and when I called (caller ID) for the best customer service person in that store, she always told me he (**) couldn't help me and when I told her I would hold on for him, she put me on hold and then hang up. When I called back, she said ** had left and wouldn't be back. I can't imagine what her problem might be. I am a native of Huntsville, been in management with the Better Business Bureau, worked with the Pentagon in Washington D.C. recruiting and manager of several staffing companies. Her bad behavior would not be tolerated in ANY establishment I have ever worked with at all. In my opinion, she is not as knowledgeable as she thinks she is, for sure. Should you need to visit that location, I suggest you request **... (if ** will allow you to speak with him.) that is!",24,,"Oct. 24, 2025 Review of T","Birmingham, AL"
"Lily and Andrew (THE GADGET GUY) made my experience so much better. BIG HUGE THANK YOU TO LILY. You guys rock fr. In the past could honestly say it was bad experience, customer service sucked but I was surprised you turned this around. Happy TMobile customer here",23,,"Oct. 23, 2025 Lily and Andrew","Ontario, CA"
"The promotions and offers are misleading. For example, I was promised “free” tracking devices, but it came with hidden fees and conditions that weren’t clearly explained upfront. Transparency in billing and promotions would go a long way in improving trust. I hope T-Mobile takes this feedback seriously and get back to me at ** or call me back to cancel the tracking device. I’d love to see them live up to the potential they advertise. This review is honest yet constructive, aiming to provide feedback that could lead to improvements.",23,,"Oct. 23, 2025 Rating","Houston, TX"
"Over 10 years, $55 month T-Mob. Now 65+ age, no job, canceled account,. Seems I went 1-2 days past above 30 days, now received Threatening bill of $4.53. I had years of barely-working 1 year old phone. Pitiful!",2,,"Oct. 23, 2025 Over 10 years,","Las Vegas, NV"
I am on my fourth year with T-Mobile. I have T-Mobile internet and my T-Mobile phone and I have a Moto phone. I have had zero problems with T-Mobile and my price is considerably less than what I used to play excuse me pay with Spectrum. I cannot be more satisfied unless they gave it to me for free!,23,,"Oct. 23, 2025 I am on my fourth year with T","Albany, NY"
I felt robbed. T-Mobile made me buy a phone when I trade one in and they scammed me. T-Mobile sucks. I wouldn't recommend someone to be scammed like that. I regret trading in my phone and also the service. Some of them are scammers.,3,,"Oct. 22, 2025 I felt robbed. T","Panorama City, CA"
"Love T-Mobile's customer service. Walked into the store today and right away both employees knew what to do. Very knowledgeable, very friendly and polite. Went out of their way to help me. It was the Macclenny store. Aleara and Stella were awesome.",22,,"Oct. 22, 2025 Love T","Jacksonville, FL"
"I placed an order for airpods which had the incorrect address, spoke with Scarlet and she told me she would cancel it. My monthly bill comes around and turns out they shipped the airpods to the wrong address and expected me to go pick them up to which I told them absolutely not. This is their mistake and I don’t have access to that address. It has been 2 MONTHS AND THEY ARE STILL ON MY BILL!!! I did not want to have to go out of my way to the store but I will be there canceling my plan tonight. DO NOT RECOMMEND!!!! THEY WILL TRY TO ROB YOU!!!",22,,"Oct. 22, 2025 I placed an order for airpods which had the incorrect address, spoke with Scarlet and she told me she would cancel it. My monthly bill comes around and turns out they shipped the airpods to the wrong address and expected me to go pick them up to which I told them absolutely not. This is their mistake and I don","Miami, FL"
"Customer service people are rude and unprofessional. I was on the phone with them for nearly 4 hours to fix small issue. Despite hanging up the phones three times, there are lack of experience and knowledge, also their service sucks. Home internet is a big joke and cell coverage is trash.",3,,"Oct. 22, 2025 Customer service people are rude and unprofessional. I was on the phone with them for nearly 4 hours to fix small issue. Despite hanging up the phones three times, there are lack of experience and knowledge, also their service sucks. Home internet is a big joke and cell coverage is trash. Thanks Shawqi","Buffalo, NY"
"My phone has been blocked for almost 2 weeks, phone is paid off, acct. Paid and they cannot unlock my phone. Numerous calls and explanations have been unsuccessful. My phone is being held hostage. I have cancer and other medical issues that I need constant contact with my doctors. I have not been able to get one person that can unlock my phone.",22,,"Oct. 22, 2025 My phone has been blocked for almost 2 weeks, phone is paid off, acct. Paid and they cannot unlock my phone. Numerous calls and explanations have been unsuccessful. My phone is being held hostage. I have cancer and other medical issues that I need constant contact with my doctors. I have not been able to get one person that can unlock my phone. Thanks for your vote","Salem, OR"
"Horrible horrible service. We spent hours in their store getting service transferred. Didn't realize we were locked in and now we have to pay $1500 per line to get out of if or wait it out to switch to decent service. The new phones are dreadful. The talk to text features are bad, the camera is bad (S25). Go with anyone else. I thought no one could be worse than Verizon...I was wrong.",22,,"Oct. 22, 2025 Horrible horrible service. We spent hours in their store getting service transferred. Didn","Vancleave, MS"
"I just want people to be aware that T-Mobile is scamming people. Sending a 748 bill for services never received on a device, never activated and returned with receipt. Double hard sales tax. Which my bank and refunded me... beware of fake text messages from Metro by T-Mobile as well.",22,,"Oct. 22, 2025 I just want people to be aware that T","Quincy, MA"
"I absolutely do not recommend this company. I am only waiting to finish paying off my “free” phone so I can leave T-Mobile as soon as possible. They also offered me a home internet service, which they described as a very good connection. Unfortunately, it turned out to be the worst home internet connection I have ever had. Never again with T-Mobile.",2,,"Oct. 21, 2025 The iPad I purchased as part of a promotion turned out to be billed at the full price. For the past six months, I have been trying to get this issue resolved, but every month the same problem appears on my bill. After calling customer service each time, I am always told that the issue will be fixed","West Babylon, NY"
"The worst ever, they are scammers, they overcharge and their customer service is the worst. I regret the day I got their services. They charged me $325, and when I called them I got the stupidest answer ever. Poor connection, poor service and overcharging.",5,,"Oct. 21, 2025 The worst ever, they are scammers, they overcharge and their customer service is the worst. I regret the day I got their services. They charged me","Dallas, TX"
T-MOBILE is phone service I have ever had. I don't think I would recommend them to anyone. I really think they are a rip off. My bills was 180$ one day and the next day it was 350$. That's a really big jump.,4,,10/21/2025 0:00,"Seattle, WA"
"We were frustrated with the poor service you received from T-Mobile at your address. We were upset that a supervisor suggested buying home internet for phone coverage and refused to provide his name or repeat his answer, then hung up on you. **What we've done so far: we are pay all the bills in time and T mobile supervisor ask us to buy internet to get services coverage so he want us to pay for another service to get the coverage from T-Mobile which we already paying for???",4,,"Oct. 21, 2025 We were frustrated with the poor service you received from T","Staten Island, NY"
"Only get 1 star because 0 wasn't an option. Worst customer service ever, misinformed employees, bs promotions. All they do is lie and apologize while never knowing what's going on. Don't switch or join. Worst move ever!!!",7,,"Oct. 20, 2025 Only get 1 star because 0 wasn","Kansas City, MO"
"I couldn’t solve the problem, my husband couldn’t solve the problem BUT Adam at the Old Keene Mill location did. Needless to say, I am most appreciative of his knowledge, patience in explains what he was doing. I walked out a very happy T-Mobile customer.",20,,"Oct. 20, 2025 I couldn","Springfield, VA"
"I agreed and they sent me the equipment. I set it up and did multiple internet speed tests and to my surprise my speeds were only in the 50 MPM range. the next day I called and cancelled the free trial and they sent me a shipping label to attach to the original box that the equipment came in. I was to deliver the return to UPS for shipping return, which I did for no charge. (I kept the receipt). It's now 10/20/2025 and I have received multiple bills that I have had to call and deal with T-Mobile phone representatives to get the charges dropped. Fortunately I kept all of my emails and telephone call names and notes and have been able to have all the erroneous charges dropped!! I would not recommend that anyone use T Mobile Services. They do not appear to know what they are doing!!!",5,,"Oct. 20, 2025 I was approached by T Mobile asking if I would be interested in trying their Wi Fi Internet service that works without a cable through the telephone cell towers. Since they offered 1 GPM service and I was looking for a new internet supplier and thought that a wireless","Kissimmee, FL"
"Very bad customer service. No honest people. Not fair. Charge you for service you do not get. They charged me for a closed line that I did not use. Customer service removed that charge, and management repost it and sent it to collection immediately!",3,,"Oct. 20, 2025 Very bad customer service. No honest people. Not fair. Charge you for service you do not get. They charged me for a closed line that I did not use. Customer service removed that charge, and management repost it and sent it to collection immediately","Alexandria, VA"
"1. Baited With Lies, Trapped With Fees They roped me in with a promotional offer they had no intention of honoring. “Free phone with trade-in,” they said. “No activation fees.” “Guaranteed coverage.” Not a single one of those claims turned out to be true. When I brought it up? Suddenly the promotion “didn’t apply to my area” or “wasn’t properly applied at signup.” Their answer? Too bad — pay up or face penalties. 2. Customer Service is a Joke (If You Can Even Reach Them) Calling T-Mobile support is like entering a black hole. You explain your issue five times to five different reps, none of whom can access the same notes. Promises of callbacks and escalation are just empty scripts. You’re met with fake apologies and robotic empathy, but never any actual solutions. It’s like being told “we care” while they stab you in the back with another fee. 3. Dispute Resolution is a Total Scam Tried to escalate my issue? Good luck. Once they’ve got your money, they hide behind “terms and conditions” you never saw. Disputes go nowhere. You're either ignored, misdirected, or gaslit into thinking you misunderstood the offer. They turn their own false advertising into your mistake. 4. Product Guarantees are Meaningless Their so-called satisfaction guarantee is a trap. I returned a device within the window — in perfect condition — and still got hit with a “restocking fee,” late return charge, and mysteriously lost trade-in credit. You can beg, plead, provide receipts — they don’t care. Once you're in the system, you're just another monthly dollar sign. 5. Deliveries and Timelines? Completely Unreliable! If they tell you “2-day shipping,” expect two weeks and a dozen excuses. “The system glitched,” “warehouse delay,” “shipping partner issue,” — they have a script for every delay. Meanwhile, your bill starts immediately, whether you have the product or not. 6. Threats, Penalties, and Intimidation Tried to cancel after being completely misled? They hit me with a termination fee, an equipment non-return fee (even though I returned the device), and a threat to send it to collections if I didn’t pay immediately. All because I refused to keep paying for a service they failed to provide. BOTTOM LINE: T-Mobile is a dishonest, manipulative company that uses false advertising to pull you in, delivers none of what they promise, then holds you financially hostage when you try to leave. If you value your time, money, sanity — run. There are far better carriers out there who treat their customers like people, not ATM machines. I wish someone had warned me before I made the mistake. Consider this your warning.",9,,"Oct. 19, 2025 WARNING","Henderson, NV"
They are a scam. I was going to switch to them and when talking to them I told them I would not be home when ups delivered the phone and they told me all’s I had to do was an e-sign and they would deliver it but T-Mobile is set up where it is in person only so I never got the phone because ups sent it back and I called and canceled the service for t mobile and 2 weeks later they changed my credit card for service I don’t have and I fought to get my money back and they shorted me $5 and 2 weeks after that I get a bill in the mail that says I owe $2.90 for service I never had.,4,,"Oct. 19, 2025 They are a scam. I was going to switch to them and when talking to them I told them I would not be home when ups delivered the phone and they told me all","Oxford, WI"
"T-MOBILE is horrible. I would not recommend them to anyone. Been with them for over 20 years and been lied to over and over. They won't do what we ask, say they will do it and then don’t. We have lines on our account that have been on there since 2015 and we have ask that they be removed thereby have been paid for for years now and they are not being used. Had a watch that was paid for that has never been used as cellular and they want remove it. Get it together, make your employees do their job right the first time",2,,10/18/2025 0:00,"Mobile, AL"
"This service is terrible. My phone service never works even in spots that T-Mobile claims they cover, my hotspot also never works. I really wouldn't recommend getting T-Mobile. Even their best service plans do not work anywhere. And if someone is nearby that has T-Mobile WiFi then T-Mobile will take my service to make the other person's wifi run better.",18,,"Oct. 18, 2025 This service is terrible. My phone service never works even in spots that T","Hobart, IN"
"I overpaid my bill before I moved in June 2025. T-Mobile sent me two bills, one in July and another in August, both showed credit for $31.00. On October 15, 2025 received a credit card nested in 10 pages of directions on how to use it in order to receive my refund of $31. Unbelievable! No other communications such as a note saying something was in the mail or apologies for the delay. Please call us and will let you know how you will get your refund. I moved in with my daughter and son-in-law. They have received checks from any and all utilities that have needed to refund money. They came within the first two months as checks or returned credit. T-Mobile took 4 months with a credit card that required detailed understanding in order to cash it, and payment of fees for certain uses or if I didn’t understand how to deposit it right away each month I would be charged three dollars. What a waste of their time in mind.!",18,,"Oct. 18, 2025 I overpaid my bill before I moved in June 2025. T","Vancouver, WA"
"They told me that my service wouldn't be interrupted, even though I hadn't sent the other box back. Yet they shut off the internet because they didn't get the box back so no, I wouldn't recommend them.",18,,"Oct. 18, 2025 They told me that my service wouldn","Pevely, MO"
"Transferred from Metro to T-Mobile. Promised one price for service, then charged another. 3 months of talking to reps without success. Nice but unhelpful. Would've cancelled service, but then would have had to return phones and start all over. Confident they were betting on this! VERY DISAPPOINTED. DID NOT HAVE ANY BILLING ISSUES WITH METRO. WILL CANCEL SERVICE AS SOON AS ""FREE"" PHONES ARE PAID OFF.",18,,"Oct. 18, 2025 Transferred from Metro to T","Mission Hills, CA"
"1 star which they don’t deserve, but you have to leave at least one star to write a review. So, I’m very disappointed with T-Mobile’s handling of my account closure. I called in July to close my entire account, which had two phone numbers on it. One of those lines had already been disconnected a month earlier, and I only needed the unlock code for the other phone so I could switch to a different carrier. During my call, I clearly stated that I wanted the entire account closed. However, T-Mobile only canceled one number and left the other line active — without my knowledge or consent. Now I’m being told I owe $262 for a service I did not use and specifically requested to be canceled. I do not believe I should be held responsible for this charge. I acted in good faith, followed the proper steps, and trusted that T-Mobile would handle the closure correctly. I hope T-Mobile reviews my account history and corrects this mistake.",17,,"Oct. 17, 2025 1 star which they don","Plano, TX"
"In speaking with customer service, it became apparent that a shell game was going on that involved us being passed around to different agents who even couldn't provide a copy of my original agreement, let alone making a decision about fairly adjusting the bogus charges. There is a billing scheme in place there that has the intention of over-billing and then stonewalling any dispute of the charges I have had service with Verizon and ATT and I can tell you they are light years better than the connivers at T-Mobile. I can't stress enough to avoid these manipulators.",17,,"Oct. 17, 2025 Rarely do I go public with experiences bad actors, but in this case I feel it is necessary. Be very aware of T","Sarasota, FL"
Finally a new internet option arrived in my town. I ordered the gateway and access point. Took a week to arrive. Difficult finding the setup instructions. Barcode on the package didn't go to instructions. Googled and got it on. Still needed to call service. She was friendly and got it working. Seemed okay until all my devices were connected. Started having problems all week. Returned it the store 7 days after setting it up and they sent me a bill for 79 bucks. They advertised free trial.,17,,"Oct. 17, 2025 Finally a new internet option arrived in my town. I ordered the gateway and access point. Took a week to arrive. Difficult finding the setup instructions. Barcode on the package didn","Holden, MA"
We have to stop these mega corporations' greed by cutting ties. I plan to start a petition to file a class action lawsuit on T-Mobile for their illegal and deceptive business practices. They are grossly overcharging for services. The management sits on recorded lines and LIES. They better count their days as consumers we hold the power to end corporate greed.,2,,"Oct. 17, 2025 We have to stop these mega corporations","Lithonia, GA"
While visiting Memphis TN I had an issue with my Android phone. It was late in the evening and I walked into a T Mobile store at 5299 Poplar Suite 101 in Memphis and was greeted by an amazing young man by the name of **. He was so professional and polite that I was incredibly pleased. He quickly fixed my problem. I told ** that I was looking to upgrade my phone but didn't have the time to do it that night. Would do it back home in California. Although he wasn't going to get the sell he spent quite a bit of time helping me. I wanted to acknowledge his amazing customer service attitude. Also wanted to give a total Shout out to his boss ** for returning my call. Great people.,17,,"Oct. 17, 2025 While visiting Memphis TN I had an issue with my Android phone. It was late in the evening and I walked into a T Mobile store at 5299 Poplar Suite 101 in Memphis and was greeted by an amazing young man by the name of","Garden Grove, CA"
"Well, by July I call cus/serv asking why? I knew my payments would be different but why. Over 2 hours on the line, they explain it was their error blah, blah, then they were charging for insurance for Razor 2025 on the wrong tier for another line I took noticed and that was supposed to be  resolved. In August bill was even hire this time, although I decided to removed the insurance on the new phone, which by the way was paid in full during the Convo in July. Same exact story, I ask why am I being charge for data for the 4th line, apparently I am in a grandfather plan and at the store they didn't even say there would be additional charges for the new line. Again another adjustment fix the data charge so I wouldn't be charged going forward. I was told all lines are the same on this plan. You can't make this stuff up. A week or so later, on the 4th line, we couldn't get online, it was saying need to use our WI-FI, my first thought was they removed the data completely on that line. I called again only to confirm my suspension was 1000%correct😡 so that was fixed. September, Lo and behold, my bill again was incorrect. I should be paying $137.15, my bill was over $155 and some change. Let the record show all these calls are made on the 16th of each month, again, another representative spoke with me. I gave all their names and the so-called manager that I never heard from since August, but that is another story for another day. They assured I should not have any more issues in October every was corrected. In September paid my bill. Wouldn't you know, yesterday 10/16/25, my bill was incorrect again. Oh yeah, my insurance for one of the other line was still being charged on two different tiers, which I never received an answer about that😡, but whatever. I was told nothing has change, it is taxed that made the cost go up. Correct me if I am wrong from a person that has worked in call centers in the past, when there are going to be any changes with services, communication are sent out and just to be sure, cust/serv reps has a script to mention this info to the customers during calls. I was like, ""Wait, you mean to tell me tax was added from last month to this month."" I was so disappointed, disgusted by that point I removed the insurance from the line that was being charged on 2 flipping tiers. The rep told me the amount my November bill will be. I can assure you it will be wrong again. At this point, by November, my family and I was planning to upgrade with 2 new phones, HELL NO. I am unsure who's worse, T-MOBILE or XFINITY. You want phone service, go to VZ/Mint Mobile, because these are the 2 companies I am looking into. T-Mobile has gone to hell.",3,,"Oct. 17, 2025 I have been with T","Providence, RI"
I called panicked because I may have lost my daughter’s SIM card to her phone while trying to transfer her sim to another phone. I had the pleasure to speak to Mr. ** who was very patient with me and calmed all my nerves down. I explained my situation which had many different layers and he explained everything will be alright. The sim isn’t that important and we would be able to recover everything that was on her phone through an email. He also gave me a number to call once everything was situated. He went above and beyond and I appreciate the interaction I had with him. Mr. ** thank you for calming my nerves down and making my day less stressful.,17,,"Oct. 17, 2025 I called panicked because I may have lost my daughter","Honolulu, HI"
"The IEMI: ** Tracking number ** I shipped it from The UPS store #3883 718 US Highway 82 E. Sherman, Tx on Wednesday October 30, 2024 at 1:04 PM Thank you for your attention. Please contact me at ** for any follow-up.",17,,"Oct. 17, 2025 I am writing to file a formal complaint regarding an unresolved issue with a phone return I completed over a year ago. Myself and my son who is on the account I have tried multiple times in the past to have this resolved. I am at my wits","Hendrix, OK"
