text,score,url,date,location
"A few weeks ago, we started experiencing what tech support representatives referred to as “intermittent” network disruptions in our area. Home internet and cell phone service both included. Customer service has not been able to give me any clear answers on when it will be resolved. After over a dozen phone calls over the last few weeks, I was finally told that the tower in our area is not able to be updated due to the owner of the land that the tower is on not allowing the technicians on to the property to complete the updates needed. We’ve been with T-Mobile for over 3 years now and have loved it and never had an overnight change like this. Now I feel like I’m getting the run around on whether or not they can even resolve the issue at any point in time. I work from home and I’m losing income because I cannot stay connected. I cannot maintain a phone call, load a video on social media, stream Netflix, or run or update applications or games on my smart TV’s or video game console. I have",1,https://www.reddit.com/r/tmobile/comments/1os7z1p/3_weeks_of_intermittent_connection/,2025-11-09 02:44:10,
"Has anyone seen and/or taken advantage of this offer? It says the discount is applied after checkout out, which makes me a bit nervous it'll get messed up.  Any quirks / catches I should be aware of? I am on Go5G Plus with 2 paid lines, 1 free phone line (from earlier this year), 1 free tablet line (from years ago), and a watch line. ",0,https://i.redd.it/skdufgwfv40g1.png,2025-11-09 01:22:32,
"Hi. I have some discounted lines on my plan. Can I swap in a phone # that I have on another cell phone with another company? How do I go about doing that? I assume if I drop lines and add lines, I will lose the discount.",0,https://www.reddit.com/r/tmobile/comments/1os5977/swapping_out_phone_s_on_some_of_my_lines/,2025-11-09 00:33:33,
"Former employee here...are they having y'all [current employees] pressure people into signing up for the new credit card in store?  If so, is there any type of spiff or compensation for doing so?  Curious, because it seems like this company has been going to shit for a long while now but the shitification has significantly ramped up in the past 1-2 years.  Have they made credit card applications a metric yet?",0,https://www.reddit.com/r/tmobile/comments/1os3v3x/commission_on_new_tmobile_credit_card/,2025-11-08 23:29:57,
"Can I upgrade my iPhone at Apple when I still have a $500 balance owed on the go5gplus plan 12 out of 24 credits applied.  Tmobiles page shows I still owe the $500 but Apple doesn’t.  

What’s the deal? Can I upgrade at Apple without having to pay off the $500 balance?  The Apple website only asks for tax but doesn’t ask for the remaining balance.  
Thanks! ",2,https://www.reddit.com/r/tmobile/comments/1os1xi4/iphone_upgrade_at_apple/,2025-11-08 22:05:53,
"I have an old ""Free On Us"" tablet line from years ago. It's been dormant in a old Netgear LTE modem for a long time racking up $1.40 fees every month.

I picked up a 5G Inseego modem for cheap to see if it'd work - and it does! I'm getting 20-100 mBit throughput in my testing. 

Curiously, I've pulled in over 20 GB of data at those speeds according to my monitor app. The line is ""Simple Choice North America 6GB MI"". Did that get un-capped when the Simple-Choice uncapping happened a few years ago? Any Caveats?",1,https://www.reddit.com/r/tmobile/comments/1os0yog/old_simple_choice_free_tablet_line_how_much_data/,2025-11-08 21:24:31,
"Hi,

What's the best promotion out there to get a new iPhone for a current T-mobile customer? Any information would be greatly appreciated.

Are there typically deals during black Friday? I can hold out a few weeks if I can get a better deal.

Thanks!",5,https://www.reddit.com/r/tmobile/comments/1os0qsr/iphone_17_promotions_current_tmobile_customer/,2025-11-08 21:15:12,
"I have Go5G+ and am holding off to see if they bump the trade in from $830 to $1000. If not, I would rather order my phone sooner than later.",0,https://www.reddit.com/r/tmobile/comments/1os0lmh/any_early_insight_into_black_friday_deals/,2025-11-08 21:09:11,
"I got a Pixel 10 on one line, which forced me to get an eSim on that line. I was assured that eSim swapping is trivial. It was trivial to deactivate the physical sim and put it on this line.

However, today, I tried to move that eSim to a Samsung Fold 3 phone. When I try I get a message that I have to call T-Mobile and give them Support Code 511 (which is basically, problem with eSim movement). eSim is not locked. (Triple checked).

The Pixel 10 is T-Mobile locked. The Fold 3 is unlocked (and I've used it many times on T-Mobile with physical sim).   
  
I call T-Mobile and get a message--after waiting 10 minutes, that there's a ""25 minute wait"" ahead.

Screw that, I have stuff to do.

WTF. So eSim is basically a dumpster file, just as I worried when I switched?",1,https://www.reddit.com/r/tmobile/comments/1orzud7/tmobile_esim_bites/,2025-11-08 20:37:36,
"[This is what my \\""Manage add-ons\\"" page shows.](https://preview.redd.it/hzbsbfpkc30g1.png?width=570&format=png&auto=webp&s=7653c992fa69bfc0649f444cec5df419454f1f0d)

My understanding is, normally you need the Go5G Next plan to get Hulu for free, but T-Mobile gave it to people on Go5G Plus who already ""Netflix On Us"" enabled as of 1/5/2024. Not sure if they just gave it to us for free for 12 months, or if I'll continue to get it for free even with Go5G+ plan.",0,https://www.reddit.com/r/tmobile/comments/1orzfij/go5g_user_who_signed_up_for_hulu_on_us_almost_a/,2025-11-08 20:19:55,
My question is that online it lets me complete the purchase even though its from google fi but when i went to sams to avoid the fees guy said google fi doesn't work for this deal which makes sense. If i complete the purchase online will they catch it later that its from google fi and jack the price up on me or take away the free phones?,1,https://www.reddit.com/r/tmobile/comments/1orz5y3/google_fi_to_tmobile_on_4100_promo/,2025-11-08 20:08:57,
"I switched to Metro By Tmobile on October 14th at a store location. I was told I’d have a hotspot on unlimited $30 plan and it was a lie. So today November 8th I have finally gotten the extra cash to go back to Tmobile and get my old hotspot plan back.

I was told by the Tmobile store I went to today that if I called customer service they would reimburse me for cost of activation fee and SIM card by putting credits on my account for my next months phone bill.

I had to pay $10 activation fee and $10 for a new SIM card. I was told my old Tmobile sim which I brought was invalid.

So I call the customer service and the lady tells me they can’t do this. I asked to speak with a manager and she tells me manager is busy and would call me back.

I’m still waiting.

What can I do? I’ve been with Tmobile since 2013 and only left because they wouldn’t give me a cheaper phone plan and the Metro store said their $30 unlimited plan was exactly the same as Tmobile $50 prepaid.

I’m so angry right now",0,https://www.reddit.com/r/tmobile/comments/1oryron/getting_ripped_off_by_tmobile/,2025-11-08 19:52:39,
"I was moved from Sprint SERO to the now, 'legacy' T-Mobile ""Advantage Unlimited"" plan a few years ago and want to stay on this plan.   
  
With the switch I got a ""free"" Iphone 13+ by way of a 2-year monthly credit that I paid off.   Now I want to upgrade to a newer phone.    
  
Will T-mo ever offer another ' free phone/upgrade offer like I received to Advantage Unlimited customers?  I.e., will they always require changing my plan or is there any chance I could get a $0, newer Iphone with a 2-year commitment, without having to drop Advantage Unlimited?    -

",0,https://www.reddit.com/r/tmobile/comments/1ory20j/will_tmobile_ever_offer_a_free_iphone_upgrade_to/,2025-11-08 19:23:14,
"Hey I have Go5G Next Data plan and I have problems with T-Mobile when I travel abroad. First time it was in Madagaskar 3 months ago. There was many times when I had full bars LTE service and it was not working. It only happened to work on 3G data. 
Now I am in Mexico, I have full bars 5G at the airport and I can’t connect to any website. I’m connected to Telcel.
During my travel in Mexico, the internet was on and off on my device with T- Mobile. It’s very frustrating for the amount I pay monthly and it doesn’t work as it should…
Anyone experienced these problems? Any fix for that? I also have iPhone 15 if that matters. ",1,https://www.reddit.com/r/tmobile/comments/1orw9ig/tmobile_data_not_working_on_roaming_abroad_while/,2025-11-08 18:11:58,
"So earlier this year, I got picked to receive a free line. I took advantage of it via Facebook and they mailed me a SIM card. I put it in my desk drawer until I needed it.  

Fast forward to a week ago when I wanted to buy a phone to actually use the line. I noticed that it wasn't showing under my account. I reached out to Tforce, and apparently there was an activation error on their end, which no one made me aware of, so now I have no free line. 

Since the promotion is gone, they said there's no way for them to fix it, so they offered me six months of free service if I add a line. I asked to speak to a supervisor, but was told that they were aware of their mistake, and that was the best they could do. 

I ended up complaining on the survey they sent me, so I got an email from someone. While deciding what to do, they called me and offered me an additional year of free service for the line, bringing it to 18 months. I appreciate it, but that doesn't come close to the savings of a free ",0,https://www.reddit.com/r/tmobile/comments/1orw24k/lost_free_line/,2025-11-08 18:03:59,
"So I have currently have 3 phone lines and 4 watch lines with Verizon and have been looking to switch to T-Mobile.  One of the watches will become a phone line so porting in 4 phone numbers & 3 watches.

When I first checked with a T-mobile store and was given a promo for $1000 off each phone without trade-in and some deals on watches too. (Can’t remember but I think it was BoG $300off 2nd watch).  There was no mention about a down payment or anything limiting the financing.

I heard about the cash & Visa cards at Costco so I went there to check.  Just about the first thing I heard was that there’s a $3600 limit for financing so I would have to make a down payment.(?)  However I assured I would still get the full thousand dollar credit for each of the phone lines.  

This is where I am confused.  If I can only finance $3600 and credits stop once things are paid off, how do I get the full $4000?

Also, is there a difference between Costco’s T-Mobile finance limit vs a T-Mobile store’s l",0,https://www.reddit.com/r/tmobile/comments/1oruzn7/tmobile_vs_costco_tmobile_financing_eli5/,2025-11-08 17:20:59,
,47,https://www.droid-life.com/2025/11/05/t-mobile-lights-up-text-to-911-for-all-satellite-users-including-non-customers/,2025-11-08 16:05:19,
"I just went to my Google wallet and I see this being added... What is this for? It doesn't really feel like is a special treatment it just looks like one one those thing that says HELLO MY NAME IS.... 


can't wait to leave TMobile in 2 months ",0,https://i.redd.it/seivh1ari10g1.png,2025-11-08 14:06:05,TX
Can I use my T-mobile credit card in two different accounts and still get the 2% back? I am Primary of one account and authorized in another. And i pay the bill for both. Perks of having a big family!,6,https://www.reddit.com/r/tmobile/comments/1orpolm/using_the_tmo_credit_card_in_2_accounts/,2025-11-08 13:40:38,
"I have one line on my plan (Go5G Plus) that is enrolled in Yearly Upgrade (former iPhone Forever Upgrade).  Is it possible to add it to one or more of the other lines on my account? 

I am asking because there was a recent post about someone successfully adding One Plus Promo to the other lines on their account, so sounds like it's still possible to add grandfathered SOCs to other lines if you already have it on your account. 

Thanks",0,https://www.reddit.com/r/tmobile/comments/1orim7g/is_it_possible_to_add_the_yearly_upgrade_benefit/,2025-11-08 06:48:18,
"Hi all, just signed up for T-Mobile via Costco yesterday. I got the Experience Beyond plan for 3 lines: 2 paid, 1 free and 3 iPhone 17 Pro’s with $1,000 credit (no trade-in required).

The Costco rep told me the max credit approval was always limited to $3600 for new accounts so I could only get 3 lines with the new phones. The only alternative was to open a business account which I did not do.

My questions are:

1. I want to bring over 2 additional lines from AT&T, how do I do this with the $3600 equipment credit cap?
2. Since my account is new and I get one free line, can I not take advantage of another BOGO right now?
3. If I can use another BOGO, what code do I need to give the reps?
4. I got 20% off added, will doing a BOGO mess that up?",4,https://www.reddit.com/r/tmobile/comments/1orih1l/new_account_via_costco/,2025-11-08 06:39:46,
"I haven't looked at plans for so long
... Is there anything even close to the unlimited Kickstarter for $45 that I currently have??",0,https://www.reddit.com/r/tmobile/comments/1ori7fj/i_have_the_tmobile_unlimited_kickstarter_plan_is/,2025-11-08 06:23:57,
My T-mobile account was cancelled. Long story short my hours at my job were cut in half and just my luck I was dealing with some health issues so all the money I had was going to my medical bills (which i’m still trying to pay) i fell about 2-3 months behind my bill and now my account is cancelled. I made a $345 payment yesterday morning. I’m not sure what I can do? Can anyone help! ,0,https://www.reddit.com/r/tmobile/comments/1ori0oc/account_cancelled/,2025-11-08 06:13:17,
"When do our T-Fiber activations show up on our ULB ranker and our ECS? I did a few last month, and they never showed up. I made sure to call my customers to make sure they got their fiber set up, and i’ve done a few this month. Still nothing. Does anyone know when this will reflect?",0,https://www.reddit.com/r/tmobile/comments/1orgslf/tfiber_commission/,2025-11-08 05:04:31,
"...to

1. Costco/T mobile?

2. Apple w/ TMO financing?

3. Samsung w/ TMO financing?

I have regular vanilla Go5G Plus.

Secondly, razr+ 2024 is showing OOS, but also a ship date in Dec. What are the chances it comes back in stock while the holiday deals are running?",1,https://www.reddit.com/r/tmobile/comments/1org55w/can_i_trade_in_a_phone_still_on_eip/,2025-11-08 04:29:56,
"If I port one of the numbers to another device on, lets say on Google FI, will the balance of said device come due? Or can i have a new number generated for that device? 

We are wanting to get a phone line for my kid, but I also want to try out Google Fi and see how it works for me since i travel more than my wife and kid... 

Tmobile support is being less than helpful... Any help here would be greatly appreciated. Thanks!",3,https://www.reddit.com/r/tmobile/comments/1orfyz2/porting_out_a_number_tied_to_a_financed_device/,2025-11-08 04:20:34,
,0,/r/verizon/comments/1orfoc6/international_roaming/,2025-11-08 04:05:57,
"Is it possible to pay early using a linked debit card? If so, will we still get the same discount? Anyone know? I like to pay my bill early if possible. Appreciate the help. ",4,https://www.reddit.com/r/tmobile/comments/1orf8iu/auto_pay_discount_debit_card/,2025-11-08 03:42:39,
"hi, i live in west virginia. we used to get awesom service especially up to 700mbps on 5G UC. for the past 6 months or more it ahs plummeted and nothing wants to load on 5G UC. 5G extended range is ok and LTE is awesome still but when it goes to UC its really bad. everyone i know across 30+ towers are having the same issues. Home internet connects to UC and has no problems what so ever. what is happening dude??",0,https://www.reddit.com/r/tmobile/comments/1ordog6/tmobile_5g_uc_problems/,2025-11-08 02:25:32,WV
"I currently have 6 lines, 3 paid 3 free in go5gplus. I intend on taking advantage of free lines in the future to fill 9 lines. Is it possible to be switched right now to the 9 line SOC, so that I’m future proof? 

I also currently get Hulu for free. Will it knock that off, or will it stay if I’m able to switch. ",0,https://www.reddit.com/r/tmobile/comments/1orbyfu/can_i_switch_to_go5gplus_9_line_soc/,2025-11-08 01:03:38,
"I switched from Verizon today, and also got a watch. The number still has not ported over, but in the app it says ""transfer number complete"" and the watch has my old number I wanted ported over. While the phone says ""no transferring number found"" and lists a temporary number. I did this process maybe 4 hours ago now, really hoping I don't need to go back to the store. ",2,https://www.reddit.com/r/tmobile/comments/1orbs4u/is_it_possible_to_port_a_number_from_a_phone_to_a/,2025-11-08 00:55:37,
"When I go into my iPhone phone app > Voicemail > Greeting and select Default, I get a really clear-sounding generic greeting that doesn’t mention my name or phone number. However, after selecting this, it doesn’t stick. When someone calls me, they get the T-Mobile voicemail greeting, which sounds really scratchy like it’s coming from 1000 miles away and speaks my phone number, which is the most anonymous T-Mobile option that was available.

Strangely, my wife’s iPhone, which is exactly the same as mine and is on the exact same rate plan as mine with the same features, plays the iPhone greeting when you call her phone.

How do I get my phone to play the iPhone greeting instead of the T-Mobile greeting?",1,https://www.reddit.com/r/tmobile/comments/1orbint/how_do_i_use_my_iphone_voicemail_greeting_instead/,2025-11-08 00:43:34,
I want to take advantage of the device payoff for people switching to T-Mobile. I'm pretty sure if I try to port from Verizon to T-Mobile that Verizon will hit me with an additional fee and not just make the remainder owed on the device due. Do I have to show them how much is due on the device at the time I port my number or can I pay the device off a day or two before and bring in the receipt from the device payoff. What exactly do I have to provide to get that reimbursement?,0,https://www.reddit.com/r/tmobile/comments/1oravty/question_about_device_payoff_when_switching/,2025-11-08 00:15:12,
,1,/r/tmobileisp/comments/1or6f9d/tfiber_install_what_to_expect/,2025-11-07 23:10:11,
"Trying to sign up online for T-Mobile because Verizon service has gotten progressively worse at our home to the point where it's unusable. Verizon is *way* too expensive to not be getting reliable service anymore.

I went through the signup process and on the checkout page, the ""Accept & Continue"" button is greyed out.

It's greyed out because there are three buttons at the bottom, all of which must be checked. And the middle one says:

""By checking this box, I agree that T-Mobile, or others acting on its behalf, may call or text me at the number provided above to receive updates and offers, and that they may use an autodialer, artificial voices, or pre-recordings to do so. I understand that my consent is not a condition of purchasing any goods or services, and that I may revoke it at any time.""

I don't want that. And it specifically says consent is not a condition of purchase. But the form won't submit unless it's checked, so it sure seems like it is.

I also found that the iPad and ",0,https://www.reddit.com/r/tmobile/comments/1or96fl/cant_sign_up_for_tmobile/,2025-11-07 23:02:18,
"I've held out and waited for any holiday deals that are available, so I guess now is the time.

I'm already on T-Mobile on my wife's plan and I'm happy with my current S22 Ultra, so I don't really need a phone per se, but if I do, it will be Samsung. I'm leaving her plan and getting my own.

I can go either consumer or business.

I'm interested in a tablet line and maybe also a hotspot.

I don't really need more than one phone line, but it's a definite possibility down the road in the near future so if it makes sense to take advantage of any deals or promos now I'm willing to do that. 

I see the essentials deal, but I'll need a few more inclusions than that plan. 

I know it's new lines for these deals, but could I do the three line option where the third line is free and port my existing number to that third line? Since it's a free line, I don't know if that's a workaround so I can still keep my current number and port that in since her plan will be losing a line.

What's my best opt",1,https://www.reddit.com/r/tmobile/comments/1or8qa4/advice_for_best_holiday_deal/,2025-11-07 22:43:49,
"
Cherokee County, Texas still has AT&T roaming. I know that Jacksonville has a T-Mobile store but ever since I've been coming here in 2018, it's always roamed to AT&T. I've gotten faster speeds beforehand, which is weird but it's working fine for me.",1,https://www.reddit.com/gallery/1or8ht7,2025-11-07 22:34:09,TX
"Mine has stopped with just the first 2 lights flashing, I've tried every troubleshooting step over I can find over the last week except one that says the fix is for t-mobile to delete my Connectivity Device Profile and then set it back up as new. The rep told me they can't or won't do that.",2,https://www.reddit.com/r/tmobile/comments/1or7px9/anybodys_cellspot_v2_femtocell_still_working/,2025-11-07 22:02:52,
,0,https://tmo.report/2025/11/t-mobile-is-handing-out-free-flagship-phones-for-the-holidays/,2025-11-07 22:00:07,
"T-Mobile announced a deal yesterday that really caught my attention:

* $1000 off any iPhone 17 model or [iPhone Air](https://www.t-mobile.com/cell-phone/apple-iphone-air?msockid=153bcf369fdc6bcb1e1cdacd9e666acf) — no trade-in required! — when switching a line to T-Mobile on [Experience Beyond](https://www.t-mobile.com/cell-phone-plans).

  
This was part of their early Black Friday press release: [https://www.t-mobile.com/news/offers/holiday-free-4-all-no-trade-needed](https://www.t-mobile.com/news/offers/holiday-free-4-all-no-trade-needed)

Apologies if this an idiotic question, but is it likely that this promo will change before Black Friday? Or do these deals normally last until Black Friday (and maybe beyond)? Just want to make sure I don't miss out on that specific promo. Thanks!

",0,https://www.reddit.com/r/tmobile/comments/1or7l7j/1000_off_promo_duration/,2025-11-07 21:57:49,
It's been on and off rough for the past three weeks. Are they going to fix this?,0,https://www.reddit.com/r/tmobile/comments/1or6m85/anyone_in_the_chicagoland_area_still_having/,2025-11-07 21:19:00,
"Most of what I've found seems like devices for laptops only, but we will need to ensure connectivity via cell phone in places where only T-Mobile seems to have signal. I'm not looking to be able to stream video or play games, but will need internet access and reliable cell signal for credit card processing. Any recommendations?",1,https://www.reddit.com/r/tmobile/comments/1or5mgq/what_is_a_good_tmobile_hotspot_device_to_make/,2025-11-07 20:40:01,
"I’m upgrading an iPhone 15, trading in the device, online order.  When I view the “Trade in Terms” document, it has my device details listed with an expiration date of TOMORROW.  
Also:
“If you fail to return your Device by the trade-in expiration date, you may be required to pay back any value or credit advanced to you.”

The new device isn’t even going to ship for a couple days, so the expiration date makes no sense.  
I shouldn’t agree to this and abandon the order, right?!?",1,https://www.reddit.com/r/tmobile/comments/1or4xh6/trade_in_terms_expires_tomorrow/,2025-11-07 20:12:46,
"Got this phone a few days ago. It seems decent so far. Only thing that's getting at me is photos. It seems there's so many folders the photos get put into. Like if I'm on google and a I save a photo then I open my gallery to use it it's no where. I find it in files. My old phone i opened my gallery and all my photos/videos where there. Now it seems I need a treasure map to locate photos. It's annoying, or am I doing something wrong??",1,https://www.reddit.com/r/tmobile/comments/1or4e41/anyone_have_the_revvl_8/,2025-11-07 19:52:30,
"Completely frustrated with Verizon.  Ordered 4 lines to upgrade and for 3.5 weeks, 1 line has been stuck and the new phone hasn't shipped.  No one can fix it at Verizon.

I need to port 4 numbers from Verizon, 1 number is tied up in pending changes.  So, 3 lines have been processed, 1 is stuck.

Of the 3 processed - only 1 phone was sent back as a trade-in.  I have  possession of the upgraded phones for the other 2 lines but neither has been activated because I'm trying to figure out my next move here.

I'd like to cancel/return the 3 upgraded phones we received, within the 30 day return policy, and port all 4 numbers over to TMobile.  I'm hoping that cancelling the entire order of 4 upgrades will release the 1 that is stuck (won't be pending changes anymore, it will be cancelled).

If for some reason, that doesn't unstick the 1 number....is it possible to port it anyway?  What would stop a number from being ported?

  
ETA:  One of the upgraded phones is still within the 30 return win",0,https://www.reddit.com/r/tmobile/comments/1or426v/can_i_port_a_number_from_verizon_to_tmobile_that/,2025-11-07 19:39:17,
"I’m in Monroe NY in Orange County. I have a T-Mobile business internet line, static IP. It’s connecting to 4 bands at a time, two of which are n41. 

Does anyone know if/when the tower may get upgraded? It’s been like this for a while and I see a lot of people posting they see n41 at 90 or 100Mhz

Thanks!",8,https://www.reddit.com/r/tmobile/comments/1or3tty/connecting_to_n41_at_40mhz_and_50mhz_will_they/,2025-11-07 19:30:27,NY
