text,score,url,date,location
We just started with them. We was told that both lines together would be 135.00 a month. We just got our bill today for 151.00. We was told that Netflix was added on our account on them. I tried setting it up and got informed that it will cost us extra to sign up. They made promises about our account to get us to sign up and are not keeping them. They want my payment on the 12th of next month. That is not 30 days from start date.,21,,"Sept. 21, 2025 We just started with them. We was told that both lines together would be 135.00 a month. We just got our bill today for 151.00. We was told that Netflix was added on our account on them. I tried setting it up and got informed that it will cost us extra to sign up. They made promises about our account to get us to sign up and are not keeping them. They want my payment on the 12th of next month. That is not 30 days from start date. Thanks for your vote","Gulfport, MS"
"2161 Pleasant Hill Rd #101, Duluth, GA 30096. I've been on the customer service hold for 1hr 29mins and counting. People in the store are pathetic. Don't know anything. I've brought on myself to activate my phone, promise I will leave Tmobile after 15 yrs.",2,,"Sept. 21, 2025 2161 Pleasant Hill Rd","Norcross, GA"
"T-Mobile is very unethical as my phone bill would be over $300 one month then drop to $270 and this has gone on for some time, also they were charging me $18 a month for Netflix when it was free with my plan and the last straw was when they were charging me for a phone they said was a free promotion also I was with them for over 10 years with an excellent payment history and would not recommend anyone use T-Mobile and if you do watch your bill closely.",2,,9/21/2025 0:00,"Tampa, FL"
"I opened my phone and it says I'm been charge for a glare screen for a phone I do not have?? I can't reach them to get the line removed and I could not removed it on ""file."" It seems I'm being slammed for a service that does not work. It's awful. If I have to I will seek other service because I'm just not happy with T-Mobile. They went up in price but the customer service is sucking badly. HELP!",2,,"Sept. 21, 2025 I have been customer since 2005. I had two phones one broke. So I put two numbers on my flip phone. I was paying for 2 services for about 45 months when I realized the other line did not work. All the calls went to voicemail. So I had to give out my personal phone to the people I worked with. Which means I have to get another personal phone. I called to straighten this out. I asked for a refund. They said","Auburn Hills, MI"
To the point. T-Mobile service is just bad.. period. Horribly weak signals in home with router and upgrade. The saddest weakest service I have EVER had the displeasure of dealing with. I really tried to hang on because their call in centers aren't bad but their coverage is well I already said it.. Gonna have to give Starlink a try. I'm thinking.,3,,"Sept. 21, 2025 To the point. T","Montgomery, TX"
"Company used to be consumer friendly, they have totally changed as they got bigger. They didn't honor a recent upgrade promo that was clearly outlined on their site and told me straight out ""too bad"". The old t mobile wouldn't do that. Their customer support is lousy, home internet stinks. Be careful dealing with these clowns. Look at their rating here - 1.4!! Awful...",21,,"Sept. 21, 2025 Company used to be consumer friendly, they have totally changed as they got bigger. They didn","US, US"
"Just gonna keep it short. Past couple weeks it's been very inconsistent. And it always happens at the worst time such as; trying to send a text, search up something, trying to call, or even a game of clash. I don’t know what’s happening with the servers right now but man has it been frustrating to deal with.",21,,"Sept. 21, 2025 Just gonna keep it short. Past couple weeks it",TX
"Very slow to open apps and download or upload. Painful! Turn tv or devices on and wait and then wait some more. When trying to connect to Amazon Prime, Netflix, You Tube, Paramount, Painful and should we still have connectivity this slow in 2025? Mediacom much faster, the only issue with them are the bait & switch rates that rise unsuspectingly. Shady shady.",21,,"Sept. 21, 2025 Very slow to open apps and download or upload. Painful","Des Moines, IA"
I heard this was a decent company. Well I gave them a try and well needless to say what a mistake. I waited on my box in the mail which was 3 days late then I had to set it up and from the time I plug it in the signal was so bad. I used my data on my phone. What a joke for internet. Then didn't even have it a month and because I didn't pay when they wanted they cut it off and charged me for 2 months. Double my bill a little more but if you're looking for internet you don't want to use this Company. I'll never recommend them to anyone and by the way I didn't even use their internet 2 hours in that month. Check somewhere else.,20,,"Sept. 20, 2025 I heard this was a decent company. Well I gave them a try and well needless to say what a mistake. I waited on my box in the mail which was 3 days late then I had to set it up and from the time I plug it in the signal was so bad. I used my data on my phone. What a joke for internet. Then didn","Kingsport, TN"
"I spent a week bouncing between store to verify my ID. Only to find out that free phone isn't free! You have to buy it first then they give you a monthly credit til the phone is paid off. BS! SCAM!! They say your ""deposit' is based on your credit. It determines how much you pay upfront for your free phone. If give you something for free then have you pay me for it, stating I will repay you on monthly payments, that is not free!",20,,"Sept. 20, 2025 I spent a week bouncing between store to verify my ID. Only to find out that free phone isn","Las Vegas, NV"
I went to a store to request a phone order change but was told I had to call the customer service line. I’ve now been waiting in the queue for an hour and still counting. Long time customer with this carrier. Considering switching to Verizon.,20,,"Sept. 20, 2025 I went to a store to request a phone order change but was told I had to call the customer service line. I","Overland Park, KS"
"People please listen to this message about T-Mobile customers care.  They are taking your information and using it without your permission to make payments and charging you a certain amount every week, when you call tmobile. I will cancel my services with this company and look for another more reliable one.",4,,"Sept. 20, 2025 People please listen to this message about T","Danvers, MA"
"So many hidden fees and so many ""late"" charges. Apparently I've been paying them since the 1st bill. I do not recommend T-Mobile. They do have good customer service as in people that answer the phone but the fees and the bills go on forever. I canceled service back in August, and I'm STILL getting bills for ""equipment fees."" I already paid for the phone....",20,,"Sept. 20, 2025 So many hidden fees and so many","Cedar City, UT"
"I want T-Mobile to refund me my money or promise what they promised. I was even sent to the store to verify me since now my account showed fraud. I provided my driver's license and while in store, the rep provided all his credentials and asked the customer care rep on phone if that was all that was needed from the store rep and I was told that was it. I was then later told, after being on phone for 2.5 hours that I would then have to return to the store to do that process all over again after waiting in store for 45 min, because T-Mobile was incompetent in doing it right the first time. This whole day has been spent trying to something simple and it turned out to be a nightmare after all of this, I was still hung up on without a call back and still not corrected my issues.",2,,"Sept. 20, 2025 I paid my balance on my account and was promised that my account would be re","Ladson, SC"
"So I called customer care, I ended up canceling my services and moving to another carrier. Fast forward two months, and they have been billing my card monthly so I disputed with my credit card. Now I get 4 calls a day. They will not talk to me because I don’t have a pin. The bypass team refuses to call for weeks. Finally, one calls me and he hangs up on me. They keep saying I have to go to a store. I can’t mentally go to a store after the embarrassment that was caused on my last visit.",2,,"Sept. 20, 2025 I experienced discrimination at T","Salem, WV"
T-Mobile is one of the biggest scams. Why should I have to pay over 4000 dollars a year for internet and shitty ass service. They won't work with you. They try to so well there's a promo going on. Well how about charge me for what the service is worth. They charge you because they can and laugh about it when you get the plan. And they don't pay taxes at all at the end of the year. But they make us pay all these surcharges and pocket the money. It's a joke.,2,,9/20/2025 0:00,"Dallas, TX"
This company stole my last payment to unblock my phone. They can’t find where the money goes. I can provide with my name and number to any manager who wants to discuss the details and I can provide without any problem.,19,,"Sept. 19, 2025 This company stole my last payment to unblock my phone. They can","Houston, TX"
"I strongly suggest you don't waste your money on the protection. And by the way, there's a assured authorized repair store not two blocks from my house. They indicated sure they can replace it. But Assurant themselves gave me a bunch of bullshit. Don't buy the protection! Read the reviews on Assurant wireless website and Google reviews. It's ridiculous. I wish I would have read it before wasting my money.",19,,"Sept. 19, 2025 I strongly advise you not spend the extra money on their protection program. It","Kansas City, MO"
I’ve been with T Mobile about 7 + years and I’ve never experienced so many discrepancies with a phone company that’s lied about the billing. I’ve been over charged every month since I started service with them. I would absolutely not refer them to anyone not even an enemy!!!!🤬🤬🤬🤬🤬,19,,"Sept. 19, 2025 I","Atlanta, GA"
"T Mobile is horrible. The price looks appealing, however they do not follow through on their word. Never swapped my account over as they never kept 3 appointments. However they debited my account on August which they refunded immediately without questions. However they did not removed my card from their system and this month September it happened again. Frustrated I call, was told it would take 24 to get an approval, but I pressed and asked what was different this month, they wanted to argue, refuse to get a supervisor on the phone. I have now been hung on 3 different times.",19,,"Sept. 19, 2025 T Mobile is horrible. The price looks appealing, however they do not follow through on their word. Never swapped my account over as they never kept 3 appointments. However they debited my account on August which they refunded immediately without questions. However they did not removed my card from their system and this month September it happened again. Frustrated I call, was told it would take 24 to get an approval, but I pressed and asked what was different this month, they wanted to argue, refuse to get a supervisor on the phone. I have now been hung on 3 different times. Thanks for your vote","Lithia Springs, GA"
"T-Mobile customer service is the worse of the worse. The English is not understandable. They promise they will do what we discuss and not follow thru. Next thing you know your bill is jacked up. English needs to be taught. Everyone is called either, Chris, Michelle, Nico or David. What are the foreign really names.",2,,9/19/2025 0:00,"Tampa, FL"
"I don't understand when you go pay your bill at the T-Mobile store, why they charge $5.00 for me to PAY MY OWN BILL???? I don't do nothing online, but if I pay cash, they charge me!!! That doesn't make any sense!! This is the only service that does that!!! Getting ready to switch back to AT&T, better service and getting their internet!!!! My bill is $98.00 every month, go pay at the store, it's $103.00... time to go!!!",3,,"Sept. 19, 2025 I don","Colton, CA"
"They kept changing back and for my plans telling me to trust them it will cost the same as $169 but that never really happened. It went back to $200 or $240 and I supposed to proof my work perk again, etc., but they never gave me $169 anymore. After three months, I ended up cancelling my account because all they do is just promising but not giving anything. I wanted to bring two phone lines from Verizon to T-Mobile with the offer Experience Beyond. iPhone On Us with a work perk 15% discount would be $140 and an extra BYOD data tablet which would be + $5 and 256GB iphone upgrade another +5$ for $150, but I ended up paying $240, even after they promised they will reduce it to $169 but that promise disappeared a month later. I ended up giving up and payout all 3 phones for $2800, after my first bill was $424, and my second supposed to be $302, but that was reduced to $169 after my complains. So Pretty much I had to buy 3 iphone from them, that I did not even needed because I already had two iPhones. Only 1 year older versions. This company and their empty promises cost me around $3300 for only 3 months period. Now I am trying to sell the phones that they gave me at least to get some money back. I was a T-Mobile customer in Europe for 16 years and never had any problems. I have been with Verizon for 10 years in the USA, switching to T-Mobile was my biggest mistake that I ever made. Oh they also told me one time that I should read the contract, meaning what they tell me might not 100% right. Well shame on me. Ok I got it, how about not making any deal with T-Mobile anymore for the rest of my life!",3,,"Sept. 19, 2025 The worst experience I had in my life, that T","Moncks Corner, SC"
They lie and say they will pay up to 800 to pay off your old plan but they cancel the payment all the time. Then when you call them they assure it's been approved but then the next day you see it denied again. Also the tech deleted all my videos and contacts right before they were suppose to transfer it. He totally factory reset the phone and it had all my family's pictures over years of kid and their first and growing up.,2,,"Sept. 19, 2025 They lie and say they will pay up to 800 to pay off your old plan but they cancel the payment all the time. Then when you call them they assure it","Chicago, IL"
"** Seen this commercial and thought about switching? High dont recommend it, been with Verizon for 15 years, switched to T-Mobile 5 days ago because I was having service issues with Verizon, I got thr best plan with T-mobile with the Starlink access, that says you can virtually send a text at least from anywhere, this is so no true, I have the same service issues in the same places as I did with Verizon even with the 600 or whatever starlink satellites they say they have.",18,,9/18/2025 0:00,"Palestine, TX"
"I called to discover each call to customer service costs me $10.00. It was for nothing. They stated I did not have a payment arrangement, even though I was looking at it on their app. They said I needed to set up and arrangement or pay it. They sent me to their automated system to set up another arrangement which is FREE. My service was turned back on, but not before getting an additional $30.00 from me: $10.00 for the phone call and $20.00 to turn my service back on which was arranged a week before. I do not think I should be charged to talk to someone for a service I am paying for and I think this was a ploy to get a restoration fee.",2,,"Sept. 18, 2025 On September 11, 2025, I made a monthly payment for service through TMobile","Massillon, OH"
"I purchased a phone a few days ago and two days later the service stopped. I called customer service who said he couldn't re-activate the phone, but transferred me to tech support. After reading off SIM numbers and other IDs, the technician concluded he could not activate the phone and transferred me to the high security activation team. That team member tried to text me a link so I could take a picture of my ID, then upload back to him. He apparently didn't understand that T Mobile had deactivated my phone, hence no text capabilities. He then emailed me a link, asked me to open, take the pic of the ID, then text back the image to him. Again, I had to explain I had no phone service. He finally said he had done all he could and told me I was out of luck. Terrible support service. I had Verizon for seven years without a problem; I'm on T-Mobile for two days and don't have a phone that works.",18,,"Sept. 18, 2025 I purchased a phone a few days ago and two days later the service stopped. I called customer service who said he couldn","Bellevue, WA"
"I signed up for T-Mobile because I was trying to save $$. I changed my mind after talking to friends that live near me so I returned the product unopened the day after I received it-returned to a store not mail. Then I received a charge on my debit card for the monthly service, I guess whoever did the return didn't close my account. Anyway...I called and the lady was vey nice and said I'd receive a refund. A week later no refund, Had to call back, talk to various people just to hear I had to wait until the end of their billing cycle to get my refund that shouldn't have been charged in the first place. So I wait. I checked my account. Still no refund. I guess I was supposed to call back again at the end of their billing cycle and ask them. Total crap! big waste of time. Not worth it at all. I 1000% do not recommend! I'd give -stars if I could.",18,,"Sept. 18, 2025 I signed up for T","Reno, NV"
"I would give them less stars if I could. They lied about a promotion then didn't give us the $800/line credit for switching phones, our bill that was suppose to go to 280 went to 423. I tried for months to get it fixed. They can never help when I have an issue. Worst customer service I've ever experienced. They cost me $5832 dollars.",2,,"Sept. 18, 2025 I would give them less stars if I could. They lied about a promotion then didn","Oakridge, OR"
"I had a 2'yr contact with T-Mobile. That's over, I changed to Mint Mobile which is owned by Tmobile. I recently lost my job because of Trump's BS and had to go with prepaid since I couldn't afford 3 months up front with mint. Can you take my service off the two cans and a string and give me some service that works? I paid almost the same amount as I was paying for post paid. How can the service be that freaking bad on prepaid. It's 100° outside where I'm at. Why do I have to go outside to use service from the same company? $70 to sit in the heat and hope I get service. Why am I back here? I should have ordered Safelink. Hey at least I know what to expect with safelink. I know I will never call that company again as long as I live. Tmobile just made #2 on that list. I AM NOT PATIENTLY WAITING FOR NOTHING! I will go phoneless before I ever call another phone company to ask ""WHY""?????? Ughhhh.",17,,"Sept. 17, 2025 I had a 2","Memphis, TN"
"Terrible reception everywhere, even though I have 5G, Technical support takes so much of my time with protocol talking and doesn't solve the problem. They apply international charges from Canada to the US when they say they don't, when I called for information. Don't get T-Mobile. I have been too lazy to change companies, but I will have to.",17,,"Sept. 17, 2025 Terrible reception everywhere, even though I have 5G, Technical support takes so much of my time with protocol talking and doesn","Culver City, CA"
This service is terrible. Nothing ever works. You are constantly trying to get ahold of someone and it takes hours just to get a simple problem resolved. I will be going somewhere else. I can’t take this anymore. If I’m paying for a service It needs to work.,17,,"Sept. 17, 2025 This service is terrible. Nothing ever works. You are constantly trying to get ahold of someone and it takes hours just to get a simple problem resolved. I will be going somewhere else. I can","Fort Myers, FL"
I closed my account due to constant poor internet connection and very poor customer service. The internet was very slow. Almost not there at all. Yet I was paying $65 a month. When I pay my bill by phone they charged additional $10. For that service. Since my disconnection I. Keep being billed $7.a month for late fees?? But I don’t have an account! Can’t use the automatic phone service because I don’t have an account to verify. Can’t talk to a representative because I don’t have account to verify. The app is useless because I no longer have an account. Can you see the nightmare this has become? If I don’t pay the 7$. a month it will compound and count against my credit too. What am I supposed to do? Keep paying $7. a month till the end of time? I’ll hand write a letter to customer relations today and certify mail it. My only other choice is to hire an attorney. T-Mobile has to be stopped somehow. I owe them nothing. What a nightmare!!,3,,"Sept. 17, 2025 I closed my account due to constant poor internet connection and very poor customer service. The internet was very slow. Almost not there at all. Yet I was paying","Miami, FL"
"Been with T-Mobile 8 plus year, so, so coverage & rate hikes, but worst of all when I transfer my lines to another carrier early this year & try to cancel theirs multiple ways, but I’m told I can do nothing w/o a 4 digit code that sent to their old line with that no longer exist to get it. Stuck paying $200 bill monthly with no way out even tho I pay the new carrier for the same transferred lines for many months now. W/o the code they say I have no authority over the account, but I’m still liable to the bill on service not provided. This security tactic bondage scam is sickening. Thieves, I’ll have to take to court to make bills stop & recoup $1000’s it’s looking like.",2,,"Sept. 17, 2025 Been with T","Port Saint Lucie, FL"
"Much like others, we were deceived (actually, I'll say it, LIED to) by the salesman (known as ""D""). You name it, he lied about it...amount to activate lines, being able to mail the items to a different address, being able to easily activate our multiple lines in multiple locations, even the case and screen protector pricing...He was wrong and/or outright lied about all of it. Was switching from Verizon because of repeated poor customer service...and wow, I think T-Mobile may have beat them, and I wasn't even a customer yet! If I was able to rate this at minus 5 stars, I likely would.",17,,"Sept. 17, 2025 Much like others, we were deceived","Columbia, SC"
"If I could rate them in negative numbers, I would. DO NOT believe ANYTHING T-Mobile tells you!!!! They lied and promised me rebates for switching. I have been waiting over 3 months, and they have every excuse in the book to not pay out. They also are charging me double what I was told it would be. The service is also AWFUL. It is slow and never works. I will keep fighting until they pay up. I have probably spent 8 hours of my time on the phone trying to work this out. I am OVER it.",2,,"Sept. 16, 2025 If I could rate them in negative numbers, I would. DO NOT believe ANYTHING T","Maryville, TN"
"So l got to another store to get some help, the store on Moreland Ave. Wonderful customer service. Fixed the problem in 1 minute. Told me those ear bugs work with a different cord. I said why didn’t they tell me that instead of saying my iPhone cord would work but it didn’t so l had to purchase a cord and a block. I don’t understand how TMObile don’t know their product and say anything. Especially when l switched over from metro, the gentleman one the phone lied about everything he was telling me about tmobile was a lie. I didn’t even know he ran my credit. He lied about the cost, the protection plan, unbelievable. But l do like my phone and the service with TMObile and also the internet was so easy to hook up. The South Harrison store was the worst crew ever, including the Manager. I never seen a worker say, l didn’t make no money off you yesterday, l don’t really have to help you. Unbelievable. I will be writing corporate too.",16,,"Sept. 16, 2025 I have never spent the whole weekend and two days at a phone carrier store. Friday 6 whole hrs. Saturday 2 hours, Sunday 1hr, Monday 1 hr, Tuesday 30 minutes. Tuesday was the worst experience, the store was smelling like weed, the gentlemen had words with another person and said he wasn","Decatur, GA"
"The store on Main St in Hamilton, Ohio the staff is rude and not helpful even the manager is rude. When you call or chat it always takes way too much time to resolve anything. They are nicer but most of the time they cannot resolve your issue. I am beyond frustrated for 3 weeks. I have been working on the same issue and have spent multiple times on the phone or in person to trying to get help.",16,,"Sept. 16, 2025 The store on Main St in Hamilton, Ohio the staff is rude and not helpful even the manager is rude. When you call or chat it always takes way too much time to resolve anything. They are nicer but most of the time they cannot resolve your issue. I am beyond frustrated for 3 weeks. I have been working on the same issue and have spent multiple times on the phone or in person to trying to get help. Thanks for your vote","Hamilton, OH"
