text,score,url,date,location
"I have never experienced such incompetence with employees. I have insurance on the phone was stolen. My claim was DENIED DUE TO T MOBILE PROVIDING ASSURANT THE INCORRECT IMEI NUMBER. This has been a disaster from start to finished. I have 8 cracked ribs and a fractured spine and yet even with that Tmobile was insisting I had to go to a store to verify my identity. I came to find out they can do it my sending a link to an alternate number. I would never recommend tmobile to anyone at all. It took everything in me to make it to a store to have someone in person figure out the correct IMEI number. T mobile outsources the customer service to the Philippines. They said over and over that my request was ""Out of their scope."" Absolutely ridiculous.",27,,"Aug. 27, 2025 I have never experienced such incompetence with employees. I have insurance on the phone was stolen. My claim was DENIED DUE TO T MOBILE PROVIDING ASSURANT THE INCORRECT IMEI NUMBER. This has been a disaster from start to finished. I have 8 cracked ribs and a fractured spine and yet even with that Tmobile was insisting I had to go to a store to verify my identity. I came to find out they can do it my sending a link to an alternate number. I would never recommend tmobile to anyone at all. It took everything in me to make it to a store to have someone in person figure out the correct IMEI number. T mobile outsources the customer service to the Philippines. They said over and over that my request was","Chicago, IL"
"Worst customer service EVER. Always has been. Had T-Mobile in the early 209’s. Paid them. They triple billed me. Agreed they did then would not return the money. I switched to Sprint who had the best customer service ever. They sold to T Mobile - now back to incompetent customer service not willing to work with you. I ordered a phone. Was scheduled to arrive on the third business day. It is now the 5th business day and hasn’t even shipped yet but they won’t cancel it. Told me, ""Go buy a phone in the store and refuse this one when it arrives"" - which now they don’t know when it will even shipped yet - says they will refund me within 10 days after they get it back. That is the worst customer service ever. I’ll take poor quality phone calls at this point. If you want a cell phone company that doesn’t care about your business sign up with T Mobile.",26,,"Aug. 26, 2025 Worst customer service EVER. Always has been. Had T","Hempstead, NY"
"Shout out to the young ladies at the Punta Gorda store in Punta Gorda FL. 2310 s Tamiami Trail. Special shout out ALEXANDRA P for your outstanding service to the community and T-Mobile. You are always friendly, polite, patient and helpful. I am grateful to have you working at this store.",26,,"Aug. 26, 2025 Shout out to the young ladies at the Punta Gorda store in Punta Gorda FL. 2310 s Tamiami Trail. Special shout out ALEXANDRA P for your outstanding service to the community and T","Port Charlotte, FL"
"Never trade in your phone with T-Mobile. They basically set up a bill for you to pay for your phone with your plans, and if you switch carriers or leave T-Mobile, they'll charge you with the ""credit"" they give you, or with what they weren't able to give you.",26,,"Aug. 26, 2025 Never trade in your phone with T","Dallas, TX"
"It is beyond frustrating to be a T-Mobile customer. I almost never have service anywhere, and my calls drop constantly. On top of that, T-Mobile has acquired and monopolized other phone companies like Boost Mobile and others, leaving customers with practically no affordable alternatives for phone service. This is very poor service, and it feels like we are forced into bad options with no real competition.",2,,"Aug. 26, 2025 It is beyond frustrating to be a T","Atlanta, GA"
"When telling T-Mobile about this and also asking where my order is, they could only repeat themselves like a parrot saying ""we are working diligently to deliver your order"" and saying there's a delay in shipment due to high amounts of orders. After they said this, magically my order has been seen and delivered and they all the sudden wrote on my order page ""there is a delay in orders"". They can't promise me a time but are yet again giving me 2 to 3 business days and will not give me next day shipping. T-Mobile doesn't care for their customers nor want to try and help at all, they just want to cover their tracks. If I were ANYONE I'd go with a different provider as I am about to cancel my order and go with one myself.",3,,"Aug. 26, 2025 I ordered the internet as it was one of the least expensive packages I","Asheville, NC"
"My child receives a lot of online studies from the school & I want to make sure he has every opportunity to stay on track. We are low-income & on government assistance. I feel the program was made for parents actually using it to better their child's education, which is why I am trying to apply. Not happy with the customer service I received & still need assistance. Thank you.",26,,"Aug. 26, 2025 I have Metro by T","San Antonio, TX"
Very bad experience after 15+ years with T-Mobile. Any time they offer you a promotion please read the contract otherwise you will pay lot more money than actual price of the device. It was happened to me. End up paying more money than the equipment. Beware of this company. Never gonna go back. Think twice before you invest with them.,25,,"Aug. 25, 2025 Very bad experience after 15","Canton, MI"
"T-Mobile is the worst about phone or internet connection. No Network, No Network at lots of places. I'm paying for nothing. It was a big mistake to jump to t-mobile. When l searched about in Seattle WA, they told me T-Mobile is the best BUT WRONG. They're all ballshit. T-mobile is the worst one. Don't buy it.",25,,8/25/2025 0:00,"Federal Way, WA"
"Had nothing but bad experiences, been with them for 3 months, regret every second of it. Constant issues with devices, dumb policies that affect customer negatively, bad pricing. I do not recommend this company.",3,,"Aug. 25, 2025 Had nothing but bad experiences, been with them for 3 months, regret every second of it. Constant issues with devices, dumb policies that affect customer negatively, bad pricing. I do not recommend this company. Thanks Anonymous",Anonymous
"I contacted their customer service and was informed, because I can't remember my pin which I never set, I would just have to go 75 miles away to a T-Mobile store to prove my identity. Guess now I have to close my bank account that T-Mobile has my direct deposit information. I am going to file a class action lawsuit, and if anyone would like to join in, my attorney will be in touch. I don't like corporations that think they can steal from their customers with impunity, and T-mobile needs to be made an example of. WORST COMPANY IN THE HISTORY OF THE UNITED STATES.",6,,"Aug. 25, 2025 I joined T",USA
"Absolute GARBAGE!!! It infuriates me every time I see your commercials about coverage everywhere. I don’t even get coverage in the middle of my city! Where I reside! I drive a truck for work and no matter where I am, I hardly EVER have service!!! I’ve had free government phones that have better service than this garbage! As soon as I can I will be dropping this trash and going somewhere else! I keep getting texts about how much fate I have used but yet, I pay for unlimited everything. Or at least that’s what my package says I had. Just an absolute garbage company and service. I wouldn’t recommend this to anybody!!! Do better! And stop lying thru your teeth on your adds! It’s disgusting! Crooks!",4,,"Aug. 24, 2025 Absolute GARBAGE","Houston, TX"
"They were completely incompetent. I was going to custom order a phone and the clerk in the store even saw me select one color and then my receipt said it was another color. The store had no idea how to fix it. I called customer service immediately. They had no idea how to fix it. I went on their webpage and got another customer service person who had no idea how to fix it. My only option was to have the phone shipped to me in the wrong color, wait to receive it, and then ship it back for a refund.",4,,"Aug. 24, 2025 They were completely incompetent. I was going to custom order a phone and the clerk in the store even saw me select one color and then my receipt said it was another color. The store had no idea how to fix it. I called customer service immediately. They had no idea how to fix it. I went on their webpage and got another customer service person who had no idea how to fix it. My only option was to have the phone shipped to me in the wrong color, wait to receive it, and then ship it back for a refund. Thanks Liz","Detroit, MI"
"Was a T-Mobile customer for a few years. I will never go back. Terrible and rude customer service. Many of the Representatives simply could not help with any problems or questions regarding bill or account. Mainly because T- Mobile requires in-store verification A LOT! T-MOBILE STOLE MONEY FROM MY ACCOUNT! T-Mobile refused to pay back the money. One representative said it was because I was no longer a customer so they had no way to return the funds another said that I owed them the money because when I transferred to a new service provider, I did not specifically LIST every number that was to be cancelled. Me just saying ""the accounts are cancelled now"" allowed them to interpret that I was only talking about the three accounts whose phone numbers I was transferring to a different provider. This loophole allowed them to keep a fourth line open. Keep in mind that I NEVER used this line and no data was used.",3,,"Aug. 24, 2025 Was a T","Seattle, WA"
I was told a price and it is completely different. Spoke to supervisor and said you record all calls please review mine. No answer and still have a bill I need to pay due to lies from TMobile. Was a good company before but going down.,23,,"Aug. 23, 2025 I was told a price and it is completely different. Spoke to supervisor and said you record all calls please review mine. No answer and still have a bill I need to pay due to lies from TMobile. Was a good company before but going down. Thanks for your vote","Mcallen, TX"
"Traveling on a train from Fargo to Montana, I lost coverage as soon as we hit Minot. My family was staying in a little town called Eureka, Fortine MT. My phone was worthless. I couldn't connect to my family's Wi-Fi signal, and there was an emergency, and I had to run down a mountain to get to a neighbor to use their phone (my abusive ex had assaulted me while I was visiting my kids and I needed to make quick arrangements to get back home). Sorry for personal details, but these were my real life experiences that called for a dependable network. I'm stuck in a contract that involved a 'promo' deal for a new z-flip 6 with a low cost payment plan and it included a 'free' Samsung smart watch as part of the deal. I was slapped with so many surprise fees, including 60$ just to help me transfer my apps to the new phone. I'm bogged down with an approximately 300$ bill every month on a 2 year payment plan. Plus one of the perks of being a T mobile customer is free Netflix, and when I took the 'promo' deal, it cancelled out my free Netflix without even telling me. Which is just stupid. I live out at a lake about 7 miles out of town, and if there are people visiting the lake with their mobile Wi-Fi, it sucks up all of my bandwidth or broadband, whichever one means that my devices load slowly if at all and just buffer forever. This is far from the coverage they advertise and if I can lose coverage at 30 miles from town or have spotty coverage at 7 miles from town, it's BS. Customer service is impossible to communicate with by phone or AI chats, and the store will just tell you tough luck. And to call customer support. T-Mobile needs to be reported.",4,,"Aug. 23, 2025 T mobile touts in its commercial with Billy Bob Thornton that it has the best 5G network coverage. But it I go 30 miles out of the city, it goes to 4G and it","Kansas City, MO"
"Please be aware there is very rude Corbin at the desk In Orange City, FL. It was Rude with a capital R from my first question. Unbelievable, then I'm told I might get charged 10. For seeking help. I called the manager and made him aware. This young man should NOT be the face of T mobile. I would give less than one star if I could.",23,,"Aug. 23, 2025 Please be aware there is very rude Corbin at the desk In Orange City, FL. It was Rude with a capital R from my first question. Unbelievable, then I","Orlando, FL"
"I have been a customer with T-Mobile for almost 6 years.. At first it was great and the price was good, customer service was great.. But now the bills are crazy high, they lie about the price, when you pay off a phone, they still charge you for the phone... Then they change your plan without telling you.. And then tell you there is nothing they can do.. When you ask for a supervisor, it's always they are not available to talk or one can call you back.. Yeah that never happens... But they can get a way with it...",23,,"Aug. 23, 2025 I have been a customer with T","Akron, OH"
Overpriced phone company! If you leave to another they cancel your account online so you can’t easily pay your bill or see past history. I was paying over 100$ more here than AT&T so of course I switched and since then they seem to not be bothered with me but won’t give me my final phone bill so AT&T can cover it.,3,,"Aug. 23, 2025 Overpriced phone company","Dallas, TX"
"I called the manager that set me up only to find out he left as well as that particular store was bought out by another and that there was nothing they could do. Would have to call customer care and see if they could help, which they said the same. Horrible customer service, I paid off the new phone and will be switching back to another company that is more honest and reliable!",23,,"Aug. 23, 2025 I switched over to T","Boerne, TX"
"Do no switch to T-mobile, you’ll regret it! Horrible billing tactics and predatory practices focused on extracting fees and charges for services not used. When you need explanation from a live person, they charge $10 extra, unexplained charges, no ability to cancel immediately and settle the balance, they do everything to keep making you pay for services not rendered.",23,,"Aug. 23, 2025 Do no switch to T","Rockville, MD"
"I added two lines to my account. I was told 190.00 bucks roughly with taxes would be my monthly bill. Bill came to 241 bucks, cashed to dispute, to only get a 10 dollar credit. I was not satisfied as my bill for this month fits not reflect to what I was told. Manager tells me they can not override another manager resolution for the credit since I agreed and I can not go back and change my mind. I didn’t agree! She basically told me what she would do doesn’t mean I agreed to it. I will be switching to another carrier. Do not do business with T Mobile.",23,,"Aug. 23, 2025 I added two lines to my account. I was told 190.00 bucks roughly with taxes would be my monthly bill. Bill came to 241 bucks, cashed to dispute, to only get a 10 dollar credit. I was not satisfied as my bill for this month fits not reflect to what I was told. Manager tells me they can not override another manager resolution for the credit since I agreed and I can not go back and change my mind. I didn","Durham, NC"
"T-Mobile, they have been overcharging us every month for a year. We traded in our phone with tracking proof—first they said they didn’t get it, then they said they did. Every month we call, they say it’s fixed, so we don’t worry, then the next month they overcharge us again. We’ve talked to supervisors, tried everything, and still nothing works. How is this allowed?",2,,8/23/2025 0:00,"Antioch, TN"
Tmobile has the worst customer service. I cancelled service 2 months ago and ported to another carrier. They have now charged me 2 more months after that and when you call to try and find out what these bills and charges are for they can't give you that information because you are no longer a Tmobile customer. This makes no sense. I just want copies of bills to see what charges they are trying to charge for. I can't even log in any longer to stop auto payment on the account. Worst customer service ever. Don't make that switch. Stay away from Tmobile if you ever think you may need to switch carriers,2,,"Aug. 23, 2025 Tmobile has the worst customer service. I cancelled service 2 months ago and ported to another carrier. They have now charged me 2 more months after that and when you call to try and find out what these bills and charges are for they can","Levittown, PA"
I had T-Mobile for a long time. I experienced dropped calls or no service regularly so I decided to switch to AT&T. When I did I paid the remainder that was owed on the account to take my number with me. A few weeks later I received a bill in the mail for $90 so I called to inquire what this bill was for because I thought I had paid them in full. They said that they are post pay so you use the service for a month and then pay. I was able to get the person on the phone to cancel the last bill. So a few weeks later I received a collection notice for $90 from t-mobile. I called again and they told me that they let you use the service for two months ahead and that this was the last month's bill. No one ever mentioned this to me and to be honest at this point I feel like they are just attempting to squeeze one last little bit of money out of me. This should be illegal.,2,,"Aug. 22, 2025 I had T","Yutan, NE"
They like to bounce you around. Went to store to cancel. Store tells you call them. You call them. They tell you go to store. Store tells you need label numbers. They won't give it to you. Nobody wants to cancel back and forth game. Had enough I just stop paying! And I was a customer for over 4 years! Never again want this service.,22,,"Aug. 22, 2025 They like to bounce you around. Went to store to cancel. Store tells you call them. You call them. They tell you go to store. Store tells you need label numbers. They won","Reading, PA"
T-Mobile is a joke! I've had nothing but problems. Every month I have to call to get an adjustment. I would not recommend T-Mobile to anybody. I can't wait for my phone to be paid off. I'm switching over this is a total joke. T-Mobile sucks.,22,,8/22/2025 0:00,TX
"Complete waste of time! T-Mobile's sales team assured me their standalone watch plan would work, but it was a total lie. After 2 weeks and 8-9 hours of troubleshooting, I was left with a non-functional watch and a huge headache. The support team was clueless, passing the buck between T-Mobile and Samsung. The local store's suggestions were laughable, and their attempt to sell me a new watch was a clear cash grab. Don't believe the hype! T-Mobile's ""standalone"" plan requires a T-mobile line to activate, making it anything but standalone. Their sales team needs to get their story straight.",22,,"Aug. 22, 2025 Complete waste of time","Washington, DC"
"Had a great experience getting Internet service with Xera at T-Mobile. Highly recommend, very professional and friendly and helpful. All staff had great customer service and willing to help as well, highly recommend.",22,,"Aug. 22, 2025 Had a great experience getting Internet service with Xera at T","Columbus, MS"
"Add charges to your bill after telling you add-ons are ‘free’ or ‘on us,’ then they charge you monthly for it. I was charged 9.99 per month for 7 months of Hulu which was supposed to be included with my plan via a promotional email they sent me. I don’t even use the service, I only added it because it was supposedly included with my plan. Can’t get past their AI robots to talk to a real human. Such a scam! Pay attention to your bills! With paperless bills and autopay, it’s so easy to get scammed by them if you’re not paying attention.",22,,"Aug. 22, 2025 Add charges to your bill after telling you add","Detroit, MI"
"They are the worst on service and customer service. We have our service less than two weeks and cut off our lines because they can’t get their act together about processing documents. As of right now we have no cell service on all 4 lines, mind you this is a business account, losing customers!!",22,,"Aug. 22, 2025 They are the worst on service and customer service. We have our service less than two weeks and cut off our lines because they can","Des Moines, IA"
Just switched from Straight Talk yesterday. I may be switching back. Not too impressed at all on coverage. I was really excited to switch to T Mobile after listening to all the advertisements. Kinda let me down.,3,,"Aug. 22, 2025 Just switched from Straight Talk yesterday. I may be switching back. Not too impressed at all on coverage. I was really excited to switch to T Mobile after listening to all the advertisements. Kinda let me down. Thanks Michael","Detroit, MI"
"I have been a T-Mobile customer for about fifteen years. Friends have tried to encourage me to switch but time after time I refused and the number one reason was ""customer service"". If I dialed 611 it usually took me at most 15 minutes to talk to a representative. The other day it was over an hour and the call finally came while I was busy helping my girl friend take groceries in and I couldn't get to it...When I did the rep had hung up. Did they make another attempt to reach me...Never happened. I carry to other people on my bill those days are about to end.",21,,"Aug. 21, 2025 I have been a T","Canoga Park, CA"
"Very poor customer service, even the supervisors are dumb who do not understand simple questions and requests from the customers. Can't even provide purchase history or receipts of recent paid bills!!!!",21,,"Aug. 21, 2025 Very poor customer service, even the supervisors are dumb who do not understand simple questions and requests from the customers. Can","Webster, NY"
"T-Mobile use to. Be the best. They hit new lows. I would strongly advise not to use them. I have had more issues with the. Billing and the nasty people In cus service. They charge you fee after fee. They turn me phone off the bill was due in a week. I come complain and they say, ""Ok we will. Turn on phone,"" but don't return fees. Stay away from t mobile. 15 yr. I am done with them.",21,,8/21/2025 0:00,"Rochester, NY"
That is what I give. This a customer over 2 decades. This is loyal honest answer. I can not do 0 stars cause is the lowest is 1 star. They have been misleading the ne gen for long time and nothing to show for and by the 611 is code for many phone carriers in North America not Just T- mobile.,21,,"Aug. 21, 2025 That is what I give. This a customer over 2 decades. This is loyal honest answer. I can not do 0 stars cause is the lowest is 1 star. They have been misleading the ne gen for long time and nothing to show for and by the 611 is code for many phone carriers in North America not Just T","Paterson, NJ"
"I have been with T Mobile for 15 years. Today I am leaving this phone company and purchasing two brand new Iphones tomorrow with Verizon. This company's customer service is absolutely horrendous. If you call to speak with a human, they have a robot hang up on you because you don't have your 15-16 digit code. Who tf remembers a 5-16 code for their phone service. They can pull it up with my number, name, address anything for the past few months. Now today they are helpless and can't access my profile. THE PHONE COMPANY I USE AND HAVE USED FOR 15 YEARS CAN'T PULL UP MY ACCOUNT! How ridiculous is that. Leaving T mobile and never coming back. BTW $101.00 a month for just basic phone service is basically robbery.",2,,"Aug. 21, 2025 I have been with T Mobile for 15 years. Today I am leaving this phone company and purchasing two brand new Iphones tomorrow with Verizon. This company","Ormond Beach, FL"
"I cancelled my phone plan in April 2025, at this time T-Mobile owed me $61.30 which they confirmed would be sent to me as a check. We are now at almost at the end of August 2025 and despite several phone calls with T-Mobile and multiple confirmation that they will send me a check they have yet to send my money. So much for being a loyal customer for 8+ years and so much for good customer service.",4,,"Aug. 20, 2025 I cancelled my phone plan in April 2025, at this time T","Houston, TX"
Tmobile will LIE to get you to sign up and then you find out the SCAMMED! After signing up and receiving my phone I went in to transfer from my old phone to the new one and found out the guy that signed me lied to me and they won't allow me to return to unused phone. DO NOT TRUST THIS COMPANY!!!!,4,,"Aug. 20, 2025 Tmobile will LIE to get you to sign up and then you find out the SCAMMED","Stockton, CA"
"Went to the store and the young lady said it wouldn’t let her cancel it because the cancel button was greyed out, so she called customer service. Customer service sent me a text message while she was on the phone with them with a UPS tracking number, but UPS hasn’t received the package yet. I believe that they did that just to shut me up because I’m tracking it and UPS still doesn’t have it in their possession. This will be the last time I order anything from them and I’m sure that I’ll be going to another company!! The service sucks in buildings and half the time outside!! Just ridiculous!!",20,,"Aug. 20, 2025 I","Carrsville, VA"
